text,web_publication_date,processed_text,tokens,assigned_topic
the government plans a fivefold increase in the number of male childcare workers to help realise its plans for dawntodusk schooling national advertising campaigns tailored to men and maleonly training courses will be used to recruit the extra staff needed for the move announced last week by the secretary of state for education ruth kelly that will enable schools to open from am to pm by around new childcare workers will be required to provide pre and afterschool supervision but some warn there will have to be a massive shift in public attitudes towards men working with children to encourage more men to apply once men have joined the childcare workforce they tend to stay just as long as women it is persuading them to make the step of joining in the first place that is the massive hurdle said charlie owen from the thomas coram research unit coauthor of men in childcare the image of the profession as womens work is the biggest hurdle compounded by the failure of careers advisers to suggest it to young men and the fear of accusations of abuse many local authorities are already planning to attract men through imaginative campaigning such as advertising at football matches and by organising free menonly seminars mentoring sessions and road shows with slogans such as men who dare childcare and coolcare some of the campaigns already attempted however have proved unsuccessful fewer than five men contacted the authorities in hereford recently after the council placed advertisements for male childcare workshops around the local football club at present there are nearly people working in childcare and per cent are women said a spokesman for the department for education and skills even in the most progressive childcare countries such as denmark and sweden men only make up around per cent of the childcare workforce nevertheless this is a figure which we aspire to we will run a campaign to attract more staff into childcare and we will be especially appealing to men it will be emphasising how much men have to offer the sector needs to draw on a wider pool of talent if it is to ensure that children receive the best quality earlyyears provision a diverse workforce enhances childrens experiences and raises their awareness of others as role models this is especially important given that many children are living in a family home without their father the target has however been rejected by some politicians for not being ambitious enough the extended schools are an excellent opportunity to involve more men and having quotas is a great way of achieving that said keith vaz mp for leicester east an excellent target would be per cent but we should not accept less than one third jack osullivan cofounder of fathers direct points to the failure of the previous government target of tripling the number of male childcare workers by when they failed to reach that target people realised how massively we are going to have to rethink our employment policies if this is to become a reality he said but it is definitely possible to achieve this target with men being more involved in bringing up their children many are realising that a career in childcare is something they could enjoy daniel brand works as a nursery assistant at the play pit nursery in felixstowe suffolk he believes many more men would come forward if they were approached in the right way more men would be interested in it than currently dare to come forward if they could be persuaded it isnt a girls profession their mates will laugh at he said i couldnt be happier though i recommend this career to all my mates every chance i get,2005-06,government plan fivefold increase number male childcare worker help realise plan dawntodusk schooling national advertising campaign tailored men maleonly training course used recruit extra staff needed move announced last week secretary state education ruth kelly enable school open pm around new childcare worker required provide pre afterschool supervision warn massive shift public attitude towards men working child encourage men apply men joined childcare workforce tend stay long woman persuading make step joining first place massive hurdle said charlie owen thomas coram research unit coauthor men childcare image profession womens work biggest hurdle compounded failure career adviser suggest young men fear accusation abuse many local authority already planning attract men imaginative campaigning advertising football match organising free menonly seminar mentoring session road show slogan men dare childcare coolcare campaign already attempted however proved unsuccessful fewer five men contacted authority hereford recently council placed advertisement male childcare workshop around local football club present nearly people working childcare per cent woman said spokesman department education skill even progressive childcare country denmark sweden men make around per cent childcare workforce nevertheless figure aspire run campaign attract staff childcare especially appealing men emphasising much men offer sector need draw wider pool talent ensure child receive best quality earlyyears provision diverse workforce enhances childrens experience raise awareness others role model especially important given many child living family home without father target ha however rejected politician ambitious enough extended school excellent opportunity involve men quota great way achieving said keith vaz mp leicester east excellent target would per cent accept less one third jack osullivan cofounder father direct point failure previous government target tripling number male childcare worker failed reach target people realised massively going rethink employment policy become reality said definitely possible achieve target men involved bringing child many realising career childcare something could enjoy daniel brand work nursery assistant play pit nursery felixstowe suffolk belief many men would come forward approached right way men would interested currently dare come forward could persuaded isnt girl profession mate laugh said couldnt happier though recommend career mate every chance get,"['government', 'plan', 'fivefold', 'increase', 'number', 'male', 'childcare', 'worker', 'help', 'realise', 'plan', 'dawntodusk', 'schooling', 'national', 'advertising', 'campaign', 'tailored', 'men', 'maleonly', 'training', 'course', 'used', 'recruit', 'extra', 'staff', 'needed', 'move', 'announced', 'last', 'week', 'secretary', 'state', 'education', 'ruth', 'kelly', 'enable', 'school', 'open', 'pm', 'around', 'new', 'childcare', 'worker', 'required', 'provide', 'pre', 'afterschool', 'supervision', 'warn', 'massive', 'shift', 'public', 'attitude', 'towards', 'men', 'working', 'child', 'encourage', 'men', 'apply', 'men', 'joined', 'childcare', 'workforce', 'tend', 'stay', 'long', 'woman', 'persuading', 'make', 'step', 'joining', 'first', 'place', 'massive', 'hurdle', 'said', 'charlie', 'owen', 'thomas', 'coram', 'research', 'unit', 'coauthor', 'men', 'childcare', 'image', 'profession', 'womens', 'work', 'biggest', 'hurdle', 'compounded', 'failure', 'career', 'adviser', 'suggest', 'young', 'men', 'fear', 'accusation', 'abuse', 'many', 'local', 'authority', 'already', 'planning', 'attract', 'men', 'imaginative', 'campaigning', 'advertising', 'football', 'match', 'organising', 'free', 'menonly', 'seminar', 'mentoring', 'session', 'road', 'show', 'slogan', 'men', 'dare', 'childcare', 'coolcare', 'campaign', 'already', 'attempted', 'however', 'proved', 'unsuccessful', 'fewer', 'five', 'men', 'contacted', 'authority', 'hereford', 'recently', 'council', 'placed', 'advertisement', 'male', 'childcare', 'workshop', 'around', 'local', 'football', 'club', 'present', 'nearly', 'people', 'working', 'childcare', 'per', 'cent', 'woman', 'said', 'spokesman', 'department', 'education', 'skill', 'even', 'progressive', 'childcare', 'country', 'denmark', 'sweden', 'men', 'make', 'around', 'per', 'cent', 'childcare', 'workforce', 'nevertheless', 'figure', 'aspire', 'run', 'campaign', 'attract', 'staff', 'childcare', 'especially', 'appealing', 'men', 'emphasising', 'much', 'men', 'offer', 'sector', 'need', 'draw', 'wider', 'pool', 'talent', 'ensure', 'child', 'receive', 'best', 'quality', 'earlyyears', 'provision', 'diverse', 'workforce', 'enhances', 'childrens', 'experience', 'raise', 'awareness', 'others', 'role', 'model', 'especially', 'important', 'given', 'many', 'child', 'living', 'family', 'home', 'without', 'father', 'target', 'ha', 'however', 'rejected', 'politician', 'ambitious', 'enough', 'extended', 'school', 'excellent', 'opportunity', 'involve', 'men', 'quota', 'great', 'way', 'achieving', 'said', 'keith', 'vaz', 'mp', 'leicester', 'east', 'excellent', 'target', 'would', 'per', 'cent', 'accept', 'less', 'one', 'third', 'jack', 'osullivan', 'cofounder', 'father', 'direct', 'point', 'failure', 'previous', 'government', 'target', 'tripling', 'number', 'male', 'childcare', 'worker', 'failed', 'reach', 'target', 'people', 'realised', 'massively', 'going', 'rethink', 'employment', 'policy', 'become', 'reality', 'said', 'definitely', 'possible', 'achieve', 'target', 'men', 'involved', 'bringing', 'child', 'many', 'realising', 'career', 'childcare', 'something', 'could', 'enjoy', 'daniel', 'brand', 'work', 'nursery', 'assistant', 'play', 'pit', 'nursery', 'felixstowe', 'suffolk', 'belief', 'many', 'men', 'would', 'come', 'forward', 'approached', 'right', 'way', 'men', 'would', 'interested', 'currently', 'dare', 'come', 'forward', 'could', 'persuaded', 'isnt', 'girl', 'profession', 'mate', 'laugh', 'said', 'couldnt', 'happier', 'though', 'recommend', 'career', 'mate', 'every', 'chance', 'get']",95
almost four out of five working fathers of babies say they would be happy to stay at home and look after their child according to research published amid fresh calls for better paternity pay and leave a survey of new dads for the equal opportunities commission published yesterday highlighted a dramatic shift in attitudes to fatherhood with the proportion of fathers who believe they should be the main provider while the mothers place is in the home falling from to in the past years almost nine out of of the fathers of infants aged between three and months questioned in the partgovernmentfunded poll by nop reported feeling as confident as their partner when caring for a child but the eocs survey did not look into why fathers generally did not act on their willingness to be at home with their babies even as the commission called on the government to bow to pressure from parents and boost paternity rights the commission which will today deliver special fathers day cards setting out its recommendations to the prime minister the chancellor and the leaders of the conservatives and liberal democrats said paternity leave should be doubled from the current two weeks to four and statutory paternity pay should increase from to a week jenny watson acting chairwoman of the eoc said all the evidence shows that fathers today are different from their own fathers and grandfathers policy makers need to keep up dads spend more time at home actively sharing the responsibility of caring for their baby,2005-06,almost four five working father baby say would happy stay home look child according research published amid fresh call better paternity pay leave survey new dad equal opportunity commission published yesterday highlighted dramatic shift attitude fatherhood proportion father believe main provider mother place home falling past year almost nine father infant aged three month questioned partgovernmentfunded poll nop reported feeling confident partner caring child eocs survey look father generally act willingness home baby even commission called government bow pressure parent boost paternity right commission today deliver special father day card setting recommendation prime minister chancellor leader conservative liberal democrat said paternity leave doubled current two week four statutory paternity pay increase week jenny watson acting chairwoman eoc said evidence show father today different father grandfather policy maker need keep dad spend time home actively sharing responsibility caring baby,"['almost', 'four', 'five', 'working', 'father', 'baby', 'say', 'would', 'happy', 'stay', 'home', 'look', 'child', 'according', 'research', 'published', 'amid', 'fresh', 'call', 'better', 'paternity', 'pay', 'leave', 'survey', 'new', 'dad', 'equal', 'opportunity', 'commission', 'published', 'yesterday', 'highlighted', 'dramatic', 'shift', 'attitude', 'fatherhood', 'proportion', 'father', 'believe', 'main', 'provider', 'mother', 'place', 'home', 'falling', 'past', 'year', 'almost', 'nine', 'father', 'infant', 'aged', 'three', 'month', 'questioned', 'partgovernmentfunded', 'poll', 'nop', 'reported', 'feeling', 'confident', 'partner', 'caring', 'child', 'eocs', 'survey', 'look', 'father', 'generally', 'act', 'willingness', 'home', 'baby', 'even', 'commission', 'called', 'government', 'bow', 'pressure', 'parent', 'boost', 'paternity', 'right', 'commission', 'today', 'deliver', 'special', 'father', 'day', 'card', 'setting', 'recommendation', 'prime', 'minister', 'chancellor', 'leader', 'conservative', 'liberal', 'democrat', 'said', 'paternity', 'leave', 'doubled', 'current', 'two', 'week', 'four', 'statutory', 'paternity', 'pay', 'increase', 'week', 'jenny', 'watson', 'acting', 'chairwoman', 'eoc', 'said', 'evidence', 'show', 'father', 'today', 'different', 'father', 'grandfather', 'policy', 'maker', 'need', 'keep', 'dad', 'spend', 'time', 'home', 'actively', 'sharing', 'responsibility', 'caring', 'baby']",200
the uks long hours culture is damaging workers personal lives and reinforcing the gender pay gap trade union leaders said today ending the uk optout and limiting the working week to hours is crucial if parents are going to be given a greater choice of how to balance their work and home life according to the trades union congress tuc currently it said long hours were forcing women to juggle paid work with looking after children and older relatives while their partners work the longest hours in europe in its submission to the governments consultation on flexible working the tuc accuses uk bosses of being obsessed with the need to work long hours it welcomed many of the new rights for parents that have been introduced but said they are merely a sticking plaster over a much bigger problem the best way for employees to achieve a better worklife balance would be to give everyone the right to work flexibly it said this would mean allowing all carers and parents of children under to ask their employers for changes in the way they work and this could be supplemented with a change in the rules surrounding parental leave so that the weeks unpaid leave parents are now allowed to take during the first five years of their childs life could be taken at any time until a child reaches their teens addressing the issue of leave for new parents the tuc said mothers should receive of earnings in the first six weeks of their maternity leave as opposed to the current rate of this would boost household income and allow many mothers to extend their leave it also recommended the introduction of earningsrelated paternity leave and increased flexibility on when the leave was taken currently fathers are allowed two weeks immediately following the birth during which time they are paid a week it argued that the low level of payment is putting fathers off exercising their right to leave a lack of childcare choice was restricting the options for parents and forcing many families into a shiftparenting system where both parents work but at different times leaving one at home to look after the children the tuc said it called for greater investment in childcare to increase the number of places available the organisation said although of parents had had their requests for a change in the way they work agreed to by their employers many experienced an increased workload or demotion as a result it called for a strengthening of the law so that employers can only turn down requests for flexible working if there is a genuine reason to do so and must put that reason in writing the business benefits of flexible working are there for all to see said the tucs general secretary brendan barber apart from the obvious impact on the individual parent who feels less stressed and more in control of their lives more motivated employees are also more productive ones increasingly people are balancing the demands of caring not only for children but also dependent adults and these workers need support and protection but long hours working is the biggest demon facing uk workers many fathers find themselves spending extra hours at work when they would really rather be at home which in turn forces their partners to reduce their hours and pay to run the home and look after children a better worklife balance where men and women could spend more time with their families and be less stressed at work would be in everyones interest,2005-06,uk long hour culture damaging worker personal life reinforcing gender pay gap trade union leader said today ending uk optout limiting working week hour crucial parent going given greater choice balance work home life according trade union congress tuc currently said long hour forcing woman juggle paid work looking child older relative partner work longest hour europe submission government consultation flexible working tuc accuses uk boss obsessed need work long hour welcomed many new right parent introduced said merely sticking plaster much bigger problem best way employee achieve better worklife balance would give everyone right work flexibly said would mean allowing carers parent child ask employer change way work could supplemented change rule surrounding parental leave week unpaid leave parent allowed take first five year child life could taken time child reach teen addressing issue leave new parent tuc said mother receive earnings first six week maternity leave opposed current rate would boost household income allow many mother extend leave also recommended introduction earningsrelated paternity leave increased flexibility leave wa taken currently father allowed two week immediately following birth time paid week argued low level payment putting father exercising right leave lack childcare choice wa restricting option parent forcing many family shiftparenting system parent work different time leaving one home look child tuc said called greater investment childcare increase number place available organisation said although parent request change way work agreed employer many experienced increased workload demotion result called strengthening law employer turn request flexible working genuine reason must put reason writing business benefit flexible working see said tucs general secretary brendan barber apart obvious impact individual parent feel less stressed control life motivated employee also productive one increasingly people balancing demand caring child also dependent adult worker need support protection long hour working biggest demon facing uk worker many father find spending extra hour work would really rather home turn force partner reduce hour pay run home look child better worklife balance men woman could spend time family less stressed work would everyones interest,"['uk', 'long', 'hour', 'culture', 'damaging', 'worker', 'personal', 'life', 'reinforcing', 'gender', 'pay', 'gap', 'trade', 'union', 'leader', 'said', 'today', 'ending', 'uk', 'optout', 'limiting', 'working', 'week', 'hour', 'crucial', 'parent', 'going', 'given', 'greater', 'choice', 'balance', 'work', 'home', 'life', 'according', 'trade', 'union', 'congress', 'tuc', 'currently', 'said', 'long', 'hour', 'forcing', 'woman', 'juggle', 'paid', 'work', 'looking', 'child', 'older', 'relative', 'partner', 'work', 'longest', 'hour', 'europe', 'submission', 'government', 'consultation', 'flexible', 'working', 'tuc', 'accuses', 'uk', 'boss', 'obsessed', 'need', 'work', 'long', 'hour', 'welcomed', 'many', 'new', 'right', 'parent', 'introduced', 'said', 'merely', 'sticking', 'plaster', 'much', 'bigger', 'problem', 'best', 'way', 'employee', 'achieve', 'better', 'worklife', 'balance', 'would', 'give', 'everyone', 'right', 'work', 'flexibly', 'said', 'would', 'mean', 'allowing', 'carers', 'parent', 'child', 'ask', 'employer', 'change', 'way', 'work', 'could', 'supplemented', 'change', 'rule', 'surrounding', 'parental', 'leave', 'week', 'unpaid', 'leave', 'parent', 'allowed', 'take', 'first', 'five', 'year', 'child', 'life', 'could', 'taken', 'time', 'child', 'reach', 'teen', 'addressing', 'issue', 'leave', 'new', 'parent', 'tuc', 'said', 'mother', 'receive', 'earnings', 'first', 'six', 'week', 'maternity', 'leave', 'opposed', 'current', 'rate', 'would', 'boost', 'household', 'income', 'allow', 'many', 'mother', 'extend', 'leave', 'also', 'recommended', 'introduction', 'earningsrelated', 'paternity', 'leave', 'increased', 'flexibility', 'leave', 'wa', 'taken', 'currently', 'father', 'allowed', 'two', 'week', 'immediately', 'following', 'birth', 'time', 'paid', 'week', 'argued', 'low', 'level', 'payment', 'putting', 'father', 'exercising', 'right', 'leave', 'lack', 'childcare', 'choice', 'wa', 'restricting', 'option', 'parent', 'forcing', 'many', 'family', 'shiftparenting', 'system', 'parent', 'work', 'different', 'time', 'leaving', 'one', 'home', 'look', 'child', 'tuc', 'said', 'called', 'greater', 'investment', 'childcare', 'increase', 'number', 'place', 'available', 'organisation', 'said', 'although', 'parent', 'request', 'change', 'way', 'work', 'agreed', 'employer', 'many', 'experienced', 'increased', 'workload', 'demotion', 'result', 'called', 'strengthening', 'law', 'employer', 'turn', 'request', 'flexible', 'working', 'genuine', 'reason', 'must', 'put', 'reason', 'writing', 'business', 'benefit', 'flexible', 'working', 'see', 'said', 'tucs', 'general', 'secretary', 'brendan', 'barber', 'apart', 'obvious', 'impact', 'individual', 'parent', 'feel', 'less', 'stressed', 'control', 'life', 'motivated', 'employee', 'also', 'productive', 'one', 'increasingly', 'people', 'balancing', 'demand', 'caring', 'child', 'also', 'dependent', 'adult', 'worker', 'need', 'support', 'protection', 'long', 'hour', 'working', 'biggest', 'demon', 'facing', 'uk', 'worker', 'many', 'father', 'find', 'spending', 'extra', 'hour', 'work', 'would', 'really', 'rather', 'home', 'turn', 'force', 'partner', 'reduce', 'hour', 'pay', 'run', 'home', 'look', 'child', 'better', 'worklife', 'balance', 'men', 'woman', 'could', 'spend', 'time', 'family', 'less', 'stressed', 'work', 'would', 'everyones', 'interest']",200
