text,web_publication_date,processed_text,tokens,assigned_topic
the preschool learning alliance is a national educational charity which has over years experience of early years education and care and adult education the charity offers a wide range of services including membership insurance an accreditation scheme a wide selection of publications and a national training programme together with the management of neighbourhood nurseries throughout england for over years the charity has provided crches at various national exhibitions and this year we are privileged to supply a crche facility for societyguardian live this service is run by qualified staff including a qualified first aider and provides resources and activities to meet the varying developmental needs of children up to five years old we are happy for parentscarers to come into the crche to settle their children so that it is a positive experience for everyone concerned each child is allocated a keyworker who will receive information from the parentscarers of their childs particular needs we have very strict guidelines regarding the registration and collection of children so parentcarers may leave their children with confidence during the course of the session the children will be offered water or fruit juice plain biscuits or fruit taking into account any allergies they may have but lunch will not be provided the maximum amount of time any child may stay is an hour and a half,2005-01,preschool learning alliance national educational charity ha year experience early year education care adult education charity offer wide range service including membership insurance accreditation scheme wide selection publication national training programme together management neighbourhood nursery throughout england year charity ha provided crches various national exhibition year privileged supply crche facility societyguardian live service run qualified staff including qualified first aider provides resource activity meet varying developmental need child five year old happy parentscarers come crche settle child positive experience everyone concerned child allocated keyworker receive information parentscarers child particular need strict guideline regarding registration collection child parentcarers may leave child confidence course session child offered water fruit juice plain biscuit fruit taking account allergy may lunch provided maximum amount time child may stay hour half,"['preschool', 'learning', 'alliance', 'national', 'educational', 'charity', 'ha', 'year', 'experience', 'early', 'year', 'education', 'care', 'adult', 'education', 'charity', 'offer', 'wide', 'range', 'service', 'including', 'membership', 'insurance', 'accreditation', 'scheme', 'wide', 'selection', 'publication', 'national', 'training', 'programme', 'together', 'management', 'neighbourhood', 'nursery', 'throughout', 'england', 'year', 'charity', 'ha', 'provided', 'crches', 'various', 'national', 'exhibition', 'year', 'privileged', 'supply', 'crche', 'facility', 'societyguardian', 'live', 'service', 'run', 'qualified', 'staff', 'including', 'qualified', 'first', 'aider', 'provides', 'resource', 'activity', 'meet', 'varying', 'developmental', 'need', 'child', 'five', 'year', 'old', 'happy', 'parentscarers', 'come', 'crche', 'settle', 'child', 'positive', 'experience', 'everyone', 'concerned', 'child', 'allocated', 'keyworker', 'receive', 'information', 'parentscarers', 'child', 'particular', 'need', 'strict', 'guideline', 'regarding', 'registration', 'collection', 'child', 'parentcarers', 'may', 'leave', 'child', 'confidence', 'course', 'session', 'child', 'offered', 'water', 'fruit', 'juice', 'plain', 'biscuit', 'fruit', 'taking', 'account', 'allergy', 'may', 'lunch', 'provided', 'maximum', 'amount', 'time', 'child', 'may', 'stay', 'hour', 'half']",95
the cost of most types of childcare underwent a rapid growth spurt last year rising by an inflationbusting per cent for nurseries and childminders the survey by childcare charity the daycare trust found that parents using nurseries in london and the south east suffered the worst rises the weekly cost of a nursery for a child under two in central london rose by per cent to a week in scotland and wales parents pay about a week parents in the west midlands pay the lowest nursery bills at just a week and parents in the north west pay the lowest childminder costs at a week the most expensive region for childminders is the south east at a week the good news for families employing nannies is that pay rates have stabilised and are even falling in some areas in london a livein nannys wages fell per cent from to a week according to the latest figures from pay roll service nannytax employing a nanny in central london is still painfully expensive however a daily nanny earns a year in the city on top of which parents must pay in employers national insurance this means one working parent must earn a gross salary of just to meet the nannys wages daycare trust or wwwdaycaretrustorguk nannytax or wwwnannytaxcouk,2005-01,cost type childcare underwent rapid growth spurt last year rising inflationbusting per cent nursery childminders survey childcare charity daycare trust found parent using nursery london south east suffered worst rise weekly cost nursery child two central london rose per cent week scotland wale parent pay week parent west midland pay lowest nursery bill week parent north west pay lowest childminder cost week expensive region childminders south east week good news family employing nanny pay rate stabilised even falling area london livein nanny wage fell per cent week according latest figure pay roll service nannytax employing nanny central london still painfully expensive however daily nanny earns year city top parent must pay employer national insurance mean one working parent must earn gross salary meet nanny wage daycare trust wwwdaycaretrustorguk nannytax wwwnannytaxcouk,"['cost', 'type', 'childcare', 'underwent', 'rapid', 'growth', 'spurt', 'last', 'year', 'rising', 'inflationbusting', 'per', 'cent', 'nursery', 'childminders', 'survey', 'childcare', 'charity', 'daycare', 'trust', 'found', 'parent', 'using', 'nursery', 'london', 'south', 'east', 'suffered', 'worst', 'rise', 'weekly', 'cost', 'nursery', 'child', 'two', 'central', 'london', 'rose', 'per', 'cent', 'week', 'scotland', 'wale', 'parent', 'pay', 'week', 'parent', 'west', 'midland', 'pay', 'lowest', 'nursery', 'bill', 'week', 'parent', 'north', 'west', 'pay', 'lowest', 'childminder', 'cost', 'week', 'expensive', 'region', 'childminders', 'south', 'east', 'week', 'good', 'news', 'family', 'employing', 'nanny', 'pay', 'rate', 'stabilised', 'even', 'falling', 'area', 'london', 'livein', 'nanny', 'wage', 'fell', 'per', 'cent', 'week', 'according', 'latest', 'figure', 'pay', 'roll', 'service', 'nannytax', 'employing', 'nanny', 'central', 'london', 'still', 'painfully', 'expensive', 'however', 'daily', 'nanny', 'earns', 'year', 'city', 'top', 'parent', 'must', 'pay', 'employer', 'national', 'insurance', 'mean', 'one', 'working', 'parent', 'must', 'earn', 'gross', 'salary', 'meet', 'nanny', 'wage', 'daycare', 'trust', 'wwwdaycaretrustorguk', 'nannytax', 'wwwnannytaxcouk']",95
the cost of childcare in britain is rising at over three times the rate of inflation with nursery fees in inner london soaring by over the last year according to a survey published today parents in the capital typically paid a week for nursery care in up from in in the worst cases london parents are paying up to a week for fulltime nursery care research by the daycare trust found while the typical cost of a fulltime nursery place for a child under two in england has reached a week up from last year the average jump in the cost of nursery places was during more than triple the rate of inflation cpi is currently at with fees much higher than average in london and the southeast costs in scotland and wales included in the survey for the first time this year are cheaper at and respectively the trusts annual survey of childcare costs comes only weeks after the government pledged more help for parents in meeting fees as part of its year childcare strategy however nursery leaders today warn that ministers goal of universal affordable and highquality childcare will not become a reality without greater direct government investment to fund expansion and better pay for higher qualified staff the national child minding association also said that quality childcare comes at a price a fulltime place with a childminder now costs an average of a week or in the southeast the costs continue even when youngsters go to school a place at an outofschool club for hours a week costs up to in another challenge to the government which will promote its childcare record and ambitions prominently in the runup to the forthcoming general election the institute for fiscal studies suggests that the childcare tax credit the complex system used to help working families meet childcare bills could be scrapped and the cash spent on creating and subsidising more highquality childcare places not only do families face huge bills for childcare most are still struggling to find highquality affordable places for their children according to the daycare trust survey almost two thirds of local childcare information services said parents were reporting difficulties securing the care they wanted trust director stephen burke said the findings of this survey may make grim reading for some but parents across the uk already know too well the inflating cost of childcare while the steps indicated by the government in its year strategy are welcome parents of children right now need more access to affordable quality childcare to suit their needs availability of good childcare was still a huge issue he added to make childcare available to all there must be significant investment in the childcare workforce both to ensure there are enough staff and to ensure they are trained to the highest standards to care for our children the national day nurseries association warned that without more government investment nursery fee increases above inflation would continue the associations chief executive rosemary murphy said currently childcare workers subsidise the cost of childcare for parents as the average fee still only supports low wages she added that much more government funding would be needed if we are to achieve truly universal affordable highquality childcare without basing it on a lowpaid and poorly qualified workforce the latest figures confirm that britains childcare remains the most expensive in europe despite accelerating government efforts to address the issue by expanding places and providing some cash help for many working parents ministers have opted to fund the demand side of childcare through tax credits in a bid to give parents choice in the childcare market but the shortage of provision there are still only enough places for one in every four children has prompted some to question the approach other european countries notably in scandinavia invest significantly larger sums and spend directly on supporting childcare places a department for education and skills spokeswoman said that from april support through the childcare element of the working tax credit would rise from a maximum of a week to for two or more children while the proportion of costs paid would increase from to in april the government is also spending m a year from to address the particular problems of london which faces a chronic childcare shortage and escalating costs manny lewis chief executive of ken livingstones london development agency said this survey confirms that london child care costs are rising considerably faster than in the rest of the country for many london families the prohibitive costs of quality childcare act as a barrier to employment,2005-01,cost childcare britain rising three time rate inflation nursery fee inner london soaring last year according survey published today parent capital typically paid week nursery care worst case london parent paying week fulltime nursery care research daycare trust found typical cost fulltime nursery place child two england ha reached week last year average jump cost nursery place wa triple rate inflation cpi currently fee much higher average london southeast cost scotland wale included survey first time year cheaper respectively trust annual survey childcare cost come week government pledged help parent meeting fee part year childcare strategy however nursery leader today warn minister goal universal affordable highquality childcare become reality without greater direct government investment fund expansion better pay higher qualified staff national child minding association also said quality childcare come price fulltime place childminder cost average week southeast cost continue even youngster go school place outofschool club hour week cost another challenge government promote childcare record ambition prominently runup forthcoming general election institute fiscal study suggests childcare tax credit complex system used help working family meet childcare bill could scrapped cash spent creating subsidising highquality childcare place family face huge bill childcare still struggling find highquality affordable place child according daycare trust survey almost two third local childcare information service said parent reporting difficulty securing care wanted trust director stephen burke said finding survey may make grim reading parent across uk already know well inflating cost childcare step indicated government year strategy welcome parent child right need access affordable quality childcare suit need availability good childcare wa still huge issue added make childcare available must significant investment childcare workforce ensure enough staff ensure trained highest standard care child national day nursery association warned without government investment nursery fee increase inflation would continue association chief executive rosemary murphy said currently childcare worker subsidise cost childcare parent average fee still support low wage added much government funding would needed achieve truly universal affordable highquality childcare without basing lowpaid poorly qualified workforce latest figure confirm britain childcare remains expensive europe despite accelerating government effort address issue expanding place providing cash help many working parent minister opted fund demand side childcare tax credit bid give parent choice childcare market shortage provision still enough place one every four child ha prompted question approach european country notably scandinavia invest significantly larger sum spend directly supporting childcare place department education skill spokeswoman said april support childcare element working tax credit would rise maximum week two child proportion cost paid would increase april government also spending year address particular problem london face chronic childcare shortage escalating cost manny lewis chief executive ken livingstone london development agency said survey confirms london child care cost rising considerably faster rest country many london family prohibitive cost quality childcare act barrier employment,"['cost', 'childcare', 'britain', 'rising', 'three', 'time', 'rate', 'inflation', 'nursery', 'fee', 'inner', 'london', 'soaring', 'last', 'year', 'according', 'survey', 'published', 'today', 'parent', 'capital', 'typically', 'paid', 'week', 'nursery', 'care', 'worst', 'case', 'london', 'parent', 'paying', 'week', 'fulltime', 'nursery', 'care', 'research', 'daycare', 'trust', 'found', 'typical', 'cost', 'fulltime', 'nursery', 'place', 'child', 'two', 'england', 'ha', 'reached', 'week', 'last', 'year', 'average', 'jump', 'cost', 'nursery', 'place', 'wa', 'triple', 'rate', 'inflation', 'cpi', 'currently', 'fee', 'much', 'higher', 'average', 'london', 'southeast', 'cost', 'scotland', 'wale', 'included', 'survey', 'first', 'time', 'year', 'cheaper', 'respectively', 'trust', 'annual', 'survey', 'childcare', 'cost', 'come', 'week', 'government', 'pledged', 'help', 'parent', 'meeting', 'fee', 'part', 'year', 'childcare', 'strategy', 'however', 'nursery', 'leader', 'today', 'warn', 'minister', 'goal', 'universal', 'affordable', 'highquality', 'childcare', 'become', 'reality', 'without', 'greater', 'direct', 'government', 'investment', 'fund', 'expansion', 'better', 'pay', 'higher', 'qualified', 'staff', 'national', 'child', 'minding', 'association', 'also', 'said', 'quality', 'childcare', 'come', 'price', 'fulltime', 'place', 'childminder', 'cost', 'average', 'week', 'southeast', 'cost', 'continue', 'even', 'youngster', 'go', 'school', 'place', 'outofschool', 'club', 'hour', 'week', 'cost', 'another', 'challenge', 'government', 'promote', 'childcare', 'record', 'ambition', 'prominently', 'runup', 'forthcoming', 'general', 'election', 'institute', 'fiscal', 'study', 'suggests', 'childcare', 'tax', 'credit', 'complex', 'system', 'used', 'help', 'working', 'family', 'meet', 'childcare', 'bill', 'could', 'scrapped', 'cash', 'spent', 'creating', 'subsidising', 'highquality', 'childcare', 'place', 'family', 'face', 'huge', 'bill', 'childcare', 'still', 'struggling', 'find', 'highquality', 'affordable', 'place', 'child', 'according', 'daycare', 'trust', 'survey', 'almost', 'two', 'third', 'local', 'childcare', 'information', 'service', 'said', 'parent', 'reporting', 'difficulty', 'securing', 'care', 'wanted', 'trust', 'director', 'stephen', 'burke', 'said', 'finding', 'survey', 'may', 'make', 'grim', 'reading', 'parent', 'across', 'uk', 'already', 'know', 'well', 'inflating', 'cost', 'childcare', 'step', 'indicated', 'government', 'year', 'strategy', 'welcome', 'parent', 'child', 'right', 'need', 'access', 'affordable', 'quality', 'childcare', 'suit', 'need', 'availability', 'good', 'childcare', 'wa', 'still', 'huge', 'issue', 'added', 'make', 'childcare', 'available', 'must', 'significant', 'investment', 'childcare', 'workforce', 'ensure', 'enough', 'staff', 'ensure', 'trained', 'highest', 'standard', 'care', 'child', 'national', 'day', 'nursery', 'association', 'warned', 'without', 'government', 'investment', 'nursery', 'fee', 'increase', 'inflation', 'would', 'continue', 'association', 'chief', 'executive', 'rosemary', 'murphy', 'said', 'currently', 'childcare', 'worker', 'subsidise', 'cost', 'childcare', 'parent', 'average', 'fee', 'still', 'support', 'low', 'wage', 'added', 'much', 'government', 'funding', 'would', 'needed', 'achieve', 'truly', 'universal', 'affordable', 'highquality', 'childcare', 'without', 'basing', 'lowpaid', 'poorly', 'qualified', 'workforce', 'latest', 'figure', 'confirm', 'britain', 'childcare', 'remains', 'expensive', 'europe', 'despite', 'accelerating', 'government', 'effort', 'address', 'issue', 'expanding', 'place', 'providing', 'cash', 'help', 'many', 'working', 'parent', 'minister', 'opted', 'fund', 'demand', 'side', 'childcare', 'tax', 'credit', 'bid', 'give', 'parent', 'choice', 'childcare', 'market', 'shortage', 'provision', 'still', 'enough', 'place', 'one', 'every', 'four', 'child', 'ha', 'prompted', 'question', 'approach', 'european', 'country', 'notably', 'scandinavia', 'invest', 'significantly', 'larger', 'sum', 'spend', 'directly', 'supporting', 'childcare', 'place', 'department', 'education', 'skill', 'spokeswoman', 'said', 'april', 'support', 'childcare', 'element', 'working', 'tax', 'credit', 'would', 'rise', 'maximum', 'week', 'two', 'child', 'proportion', 'cost', 'paid', 'would', 'increase', 'april', 'government', 'also', 'spending', 'year', 'address', 'particular', 'problem', 'london', 'face', 'chronic', 'childcare', 'shortage', 'escalating', 'cost', 'manny', 'lewis', 'chief', 'executive', 'ken', 'livingstone', 'london', 'development', 'agency', 'said', 'survey', 'confirms', 'london', 'child', 'care', 'cost', 'rising', 'considerably', 'faster', 'rest', 'country', 'many', 'london', 'family', 'prohibitive', 'cost', 'quality', 'childcare', 'act', 'barrier', 'employment']",95
its like having a second mortgage says michelle thornhill a management accountant and mother of two paying for fulltime nursery care for her monthold son kieran nursery fees of a week over a month take a substantial chunk out of the familys budget according to mrs thornhill who encountered even higher fees at some nurseries near her home in southeast london the bills around the average for outer london reflect the particularly high cost of childcare in the capital where demand far outstrips supply i would hate to imagine how people on lower salaries manage mrs thornhill says many nurseries she researched during a long hunt for a suitable place for kieran had waiting lists of a year or even longer theres such a demand yet many are so awful she says one nursery she looked at for her daughter tia now six charged a week yet had no outdoor space bars on the windows and was just appalling as parents scramble to find coveted places nurseries put their prices up every january she says because they know there will be a queue of young children ready to toddle through their doors government support mrs thornhill believes is hopelessly inadequate the family husband douglas works for british telecom qualifies for a week in state help via the childcare element of the working tax credit the state would do better to spend the money on creating more and cheaper nursery places she argues i would prefer the government to invest more money in more nurseries and make more incentives for organisations to have onsite nurseries this would be a great benefit to a lot of people she said i am sure a lot of people are suffering through it parents are doing things like delaying getting kids new shoes because they just cant afford it,2005-01,like second mortgage say michelle thornhill management accountant mother two paying fulltime nursery care monthold son kieran nursery fee week month take substantial chunk family budget according mr thornhill encountered even higher fee nursery near home southeast london bill around average outer london reflect particularly high cost childcare capital demand far outstrips supply would hate imagine people lower salary manage mr thornhill say many nursery researched long hunt suitable place kieran waiting list year even longer demand yet many awful say one nursery looked daughter tia six charged week yet outdoor space bar window wa appalling parent scramble find coveted place nursery put price every january say know queue young child ready toddle door government support mr thornhill belief hopelessly inadequate family husband douglas work british telecom qualifies week state help via childcare element working tax credit state would better spend money creating cheaper nursery place argues would prefer government invest money nursery make incentive organisation onsite nursery would great benefit lot people said sure lot people suffering parent thing like delaying getting kid new shoe cant afford,"['like', 'second', 'mortgage', 'say', 'michelle', 'thornhill', 'management', 'accountant', 'mother', 'two', 'paying', 'fulltime', 'nursery', 'care', 'monthold', 'son', 'kieran', 'nursery', 'fee', 'week', 'month', 'take', 'substantial', 'chunk', 'family', 'budget', 'according', 'mr', 'thornhill', 'encountered', 'even', 'higher', 'fee', 'nursery', 'near', 'home', 'southeast', 'london', 'bill', 'around', 'average', 'outer', 'london', 'reflect', 'particularly', 'high', 'cost', 'childcare', 'capital', 'demand', 'far', 'outstrips', 'supply', 'would', 'hate', 'imagine', 'people', 'lower', 'salary', 'manage', 'mr', 'thornhill', 'say', 'many', 'nursery', 'researched', 'long', 'hunt', 'suitable', 'place', 'kieran', 'waiting', 'list', 'year', 'even', 'longer', 'demand', 'yet', 'many', 'awful', 'say', 'one', 'nursery', 'looked', 'daughter', 'tia', 'six', 'charged', 'week', 'yet', 'outdoor', 'space', 'bar', 'window', 'wa', 'appalling', 'parent', 'scramble', 'find', 'coveted', 'place', 'nursery', 'put', 'price', 'every', 'january', 'say', 'know', 'queue', 'young', 'child', 'ready', 'toddle', 'door', 'government', 'support', 'mr', 'thornhill', 'belief', 'hopelessly', 'inadequate', 'family', 'husband', 'douglas', 'work', 'british', 'telecom', 'qualifies', 'week', 'state', 'help', 'via', 'childcare', 'element', 'working', 'tax', 'credit', 'state', 'would', 'better', 'spend', 'money', 'creating', 'cheaper', 'nursery', 'place', 'argues', 'would', 'prefer', 'government', 'invest', 'money', 'nursery', 'make', 'incentive', 'organisation', 'onsite', 'nursery', 'would', 'great', 'benefit', 'lot', 'people', 'said', 'sure', 'lot', 'people', 'suffering', 'parent', 'thing', 'like', 'delaying', 'getting', 'kid', 'new', 'shoe', 'cant', 'afford']",95
