text,web_publication_date,processed_text,tokens,assigned_topic
hundreds of thousands of new fathers were given a boost today when the government confirmed plans to give them up to three months paid paternity leave maternity pay was also increased to nine months under moves which the government said would increase equality and flexibility in britains workplaces the proposals were outlined in the work and families bill published today by the trade and industry secretary alan johnson he said the bill was designed to create a modern framework of employment rights and maintained that it would have a minimal impact on business despite concerns especially from smaller firms that they will suffer because of the new rights under the bill fathers will be able to take up to six months unpaid leave but will receive paternity pay for three months if a mother returns to work after six months and before her maternity leave ends this would be at the rate of a week which would be reimbursed to companies by the treasury the department of trade and industry said up to fathers could benefit from the plan which will now go out to consultation todays bill delivers on our commitment to help working parents balance the demands of their job with caring for their children by introducing a modern framework of rights and responsibilities that offers real choice and flexibility said mr johnson to help mothers we will extend paid maternity leave to nine months with the aim of increasing it to a year increasingly fathers want to play a more active role in bringing up their children so we will help them take time off when the mother returns to work by introducing a new right to paternity leave mr johnson maintained there was broad support from both sides of industry for the family friendly measures and he said he was also introducing a number of proposals to make it easier for businesses to deal with workers taking time off under the bill statutory maternity pay will be increased to nine months from april with the ambition of moving it to a year by the end of the current parliament the right to request flexible working currently limited to parents of young children will be extended to carers from april the government also announced that it wanted to introduce so called keeping in touch days so that women on maternity leave can go into work for a few days without losing their statutory pay the period of notice for returning to work from maternity leave will be extended to two months unions and campaigners for fathers rights warmly welcomed todays announcement offering extended paternity leave with the option of some payment is an important first step towards reforming our antiquated leave system and giving parents real choice as to who looks after a baby said duncan fisher chief executive of campaign group fathers direct but it will not be a practical option for most families until the new paternity leave is properly paid the government should build on this first step to move more quickly to support properly the huge social change that sees fathers now doing onethird of the practical childcare of the underfives employers were taken by surprise by the announcement and said the government had underestimated the impact of the new rules on smaller firms employers have worked extremely hard to adjust to the large volume of familyfriendly and flexible working practices introduced by the government over a very short timeframe said john cridland deputy directorgeneral of the confederation of british industry the business community recognises the aspirations of their employees but the unexpected new right for fathers which wasnt even in the labour manifesto has caused concern particularly among smaller firms this is not just about money although there will be undeniable pressure to pay occupational paternity pay equally importantly this is about planning and the very ability of smaller companies to stay in business,2005-10,hundred thousand new father given boost today government confirmed plan give three month paid paternity leave maternity pay wa also increased nine month move government said would increase equality flexibility britain workplace proposal outlined work family bill published today trade industry secretary alan johnson said bill wa designed create modern framework employment right maintained would minimal impact business despite concern especially smaller firm suffer new right bill father able take six month unpaid leave receive paternity pay three month mother return work six month maternity leave end would rate week would reimbursed company treasury department trade industry said father could benefit plan go consultation today bill delivers commitment help working parent balance demand job caring child introducing modern framework right responsibility offer real choice flexibility said mr johnson help mother extend paid maternity leave nine month aim increasing year increasingly father want play active role bringing child help take time mother return work introducing new right paternity leave mr johnson maintained wa broad support side industry family friendly measure said wa also introducing number proposal make easier business deal worker taking time bill statutory maternity pay increased nine month april ambition moving year end current parliament right request flexible working currently limited parent young child extended carers april government also announced wanted introduce called keeping touch day woman maternity leave go work day without losing statutory pay period notice returning work maternity leave extended two month union campaigner father right warmly welcomed today announcement offering extended paternity leave option payment important first step towards reforming antiquated leave system giving parent real choice look baby said duncan fisher chief executive campaign group father direct practical option family new paternity leave properly paid government build first step move quickly support properly huge social change see father onethird practical childcare underfives employer taken surprise announcement said government underestimated impact new rule smaller firm employer worked extremely hard adjust large volume familyfriendly flexible working practice introduced government short timeframe said john cridland deputy directorgeneral confederation british industry business community recognises aspiration employee unexpected new right father wasnt even labour manifesto ha caused concern particularly among smaller firm money although undeniable pressure pay occupational paternity pay equally importantly planning ability smaller company stay business,"['hundred', 'thousand', 'new', 'father', 'given', 'boost', 'today', 'government', 'confirmed', 'plan', 'give', 'three', 'month', 'paid', 'paternity', 'leave', 'maternity', 'pay', 'wa', 'also', 'increased', 'nine', 'month', 'move', 'government', 'said', 'would', 'increase', 'equality', 'flexibility', 'britain', 'workplace', 'proposal', 'outlined', 'work', 'family', 'bill', 'published', 'today', 'trade', 'industry', 'secretary', 'alan', 'johnson', 'said', 'bill', 'wa', 'designed', 'create', 'modern', 'framework', 'employment', 'right', 'maintained', 'would', 'minimal', 'impact', 'business', 'despite', 'concern', 'especially', 'smaller', 'firm', 'suffer', 'new', 'right', 'bill', 'father', 'able', 'take', 'six', 'month', 'unpaid', 'leave', 'receive', 'paternity', 'pay', 'three', 'month', 'mother', 'return', 'work', 'six', 'month', 'maternity', 'leave', 'end', 'would', 'rate', 'week', 'would', 'reimbursed', 'company', 'treasury', 'department', 'trade', 'industry', 'said', 'father', 'could', 'benefit', 'plan', 'go', 'consultation', 'today', 'bill', 'delivers', 'commitment', 'help', 'working', 'parent', 'balance', 'demand', 'job', 'caring', 'child', 'introducing', 'modern', 'framework', 'right', 'responsibility', 'offer', 'real', 'choice', 'flexibility', 'said', 'mr', 'johnson', 'help', 'mother', 'extend', 'paid', 'maternity', 'leave', 'nine', 'month', 'aim', 'increasing', 'year', 'increasingly', 'father', 'want', 'play', 'active', 'role', 'bringing', 'child', 'help', 'take', 'time', 'mother', 'return', 'work', 'introducing', 'new', 'right', 'paternity', 'leave', 'mr', 'johnson', 'maintained', 'wa', 'broad', 'support', 'side', 'industry', 'family', 'friendly', 'measure', 'said', 'wa', 'also', 'introducing', 'number', 'proposal', 'make', 'easier', 'business', 'deal', 'worker', 'taking', 'time', 'bill', 'statutory', 'maternity', 'pay', 'increased', 'nine', 'month', 'april', 'ambition', 'moving', 'year', 'end', 'current', 'parliament', 'right', 'request', 'flexible', 'working', 'currently', 'limited', 'parent', 'young', 'child', 'extended', 'carers', 'april', 'government', 'also', 'announced', 'wanted', 'introduce', 'called', 'keeping', 'touch', 'day', 'woman', 'maternity', 'leave', 'go', 'work', 'day', 'without', 'losing', 'statutory', 'pay', 'period', 'notice', 'returning', 'work', 'maternity', 'leave', 'extended', 'two', 'month', 'union', 'campaigner', 'father', 'right', 'warmly', 'welcomed', 'today', 'announcement', 'offering', 'extended', 'paternity', 'leave', 'option', 'payment', 'important', 'first', 'step', 'towards', 'reforming', 'antiquated', 'leave', 'system', 'giving', 'parent', 'real', 'choice', 'look', 'baby', 'said', 'duncan', 'fisher', 'chief', 'executive', 'campaign', 'group', 'father', 'direct', 'practical', 'option', 'family', 'new', 'paternity', 'leave', 'properly', 'paid', 'government', 'build', 'first', 'step', 'move', 'quickly', 'support', 'properly', 'huge', 'social', 'change', 'see', 'father', 'onethird', 'practical', 'childcare', 'underfives', 'employer', 'taken', 'surprise', 'announcement', 'said', 'government', 'underestimated', 'impact', 'new', 'rule', 'smaller', 'firm', 'employer', 'worked', 'extremely', 'hard', 'adjust', 'large', 'volume', 'familyfriendly', 'flexible', 'working', 'practice', 'introduced', 'government', 'short', 'timeframe', 'said', 'john', 'cridland', 'deputy', 'directorgeneral', 'confederation', 'british', 'industry', 'business', 'community', 'recognises', 'aspiration', 'employee', 'unexpected', 'new', 'right', 'father', 'wasnt', 'even', 'labour', 'manifesto', 'ha', 'caused', 'concern', 'particularly', 'among', 'smaller', 'firm', 'money', 'although', 'undeniable', 'pressure', 'pay', 'occupational', 'paternity', 'pay', 'equally', 'importantly', 'planning', 'ability', 'smaller', 'company', 'stay', 'business']",200
childrens day nurseries in britain are on average only three quarters full the lowest level for five years as parents face aboveinflation fee increases according to a survey published today in some areas including the home counties one of the most expensive areas for nursery provision almost a third of places are unfilled on average figures show most vacant places are for three and fouryearolds indicating that parents are increasingly opting to take up free nursery places for those age groups in schools now available to all who want them the evidence of declining occupancy levels prompted nursery leaders to warn the fall had major implications for the sustainability of the day nursery sector closures would limit choice for parents the national day nurseries association ndna said warning that increasing staff costs must be covered by the government and not parents the survey conducted for nursery amp childcare market news also found fees charged by nurseries increased by an average of above the rate of inflation over the last months and are anticipated to rise by a similar rate in the next year childcare costs in the uk are already the highest in europe with fees in london and the southeast of england particularly steep the typical weekly cost to parents of a full time nursery place is and more for babies planned fee rises of in the coming months would mean an average place will cost by next year in an ironic twist given the uks historically inadequate childcare provision the fall in day nursery rolls could be the result of an increase in governmentfunded nursery places which combined with private sector numbers have led to an oversupply though many parents will still find themselves priced out of a private nursery option nurseries are likely to have to increase fees to meet growing staff costs as they try to recruit and retain workers nursery staff are notoriously poorly paid but the government wants pay to increase in exchange for a better qualified workforce purnima tanuku the ndna chief executive expressed serious concerns about falling rolls she urged local authorites who under a forthcoming childcare bill will be obliged to provide sufficient childcare for their local areas to work closely with existing private and voluntary day nurseries to avoid duplication of services parents could not afford to meet the increased cost of staff salaries as the government aimed to provide universal high quality childcare she warned to meet its goals the amount of government funding must be reviewed and increased significantly she said,2005-10,childrens day nursery britain average three quarter full lowest level five year parent face aboveinflation fee increase according survey published today area including home county one expensive area nursery provision almost third place unfilled average figure show vacant place three fouryearolds indicating parent increasingly opting take free nursery place age group school available want evidence declining occupancy level prompted nursery leader warn fall major implication sustainability day nursery sector closure would limit choice parent national day nursery association ndna said warning increasing staff cost must covered government parent survey conducted nursery amp childcare market news also found fee charged nursery increased average rate inflation last month anticipated rise similar rate next year childcare cost uk already highest europe fee london southeast england particularly steep typical weekly cost parent full time nursery place baby planned fee rise coming month would mean average place cost next year ironic twist given uk historically inadequate childcare provision fall day nursery roll could result increase governmentfunded nursery place combined private sector number led oversupply though many parent still find priced private nursery option nursery likely increase fee meet growing staff cost try recruit retain worker nursery staff notoriously poorly paid government want pay increase exchange better qualified workforce purnima tanuku ndna chief executive expressed serious concern falling roll urged local authorites forthcoming childcare bill obliged provide sufficient childcare local area work closely existing private voluntary day nursery avoid duplication service parent could afford meet increased cost staff salary government aimed provide universal high quality childcare warned meet goal amount government funding must reviewed increased significantly said,"['childrens', 'day', 'nursery', 'britain', 'average', 'three', 'quarter', 'full', 'lowest', 'level', 'five', 'year', 'parent', 'face', 'aboveinflation', 'fee', 'increase', 'according', 'survey', 'published', 'today', 'area', 'including', 'home', 'county', 'one', 'expensive', 'area', 'nursery', 'provision', 'almost', 'third', 'place', 'unfilled', 'average', 'figure', 'show', 'vacant', 'place', 'three', 'fouryearolds', 'indicating', 'parent', 'increasingly', 'opting', 'take', 'free', 'nursery', 'place', 'age', 'group', 'school', 'available', 'want', 'evidence', 'declining', 'occupancy', 'level', 'prompted', 'nursery', 'leader', 'warn', 'fall', 'major', 'implication', 'sustainability', 'day', 'nursery', 'sector', 'closure', 'would', 'limit', 'choice', 'parent', 'national', 'day', 'nursery', 'association', 'ndna', 'said', 'warning', 'increasing', 'staff', 'cost', 'must', 'covered', 'government', 'parent', 'survey', 'conducted', 'nursery', 'amp', 'childcare', 'market', 'news', 'also', 'found', 'fee', 'charged', 'nursery', 'increased', 'average', 'rate', 'inflation', 'last', 'month', 'anticipated', 'rise', 'similar', 'rate', 'next', 'year', 'childcare', 'cost', 'uk', 'already', 'highest', 'europe', 'fee', 'london', 'southeast', 'england', 'particularly', 'steep', 'typical', 'weekly', 'cost', 'parent', 'full', 'time', 'nursery', 'place', 'baby', 'planned', 'fee', 'rise', 'coming', 'month', 'would', 'mean', 'average', 'place', 'cost', 'next', 'year', 'ironic', 'twist', 'given', 'uk', 'historically', 'inadequate', 'childcare', 'provision', 'fall', 'day', 'nursery', 'roll', 'could', 'result', 'increase', 'governmentfunded', 'nursery', 'place', 'combined', 'private', 'sector', 'number', 'led', 'oversupply', 'though', 'many', 'parent', 'still', 'find', 'priced', 'private', 'nursery', 'option', 'nursery', 'likely', 'increase', 'fee', 'meet', 'growing', 'staff', 'cost', 'try', 'recruit', 'retain', 'worker', 'nursery', 'staff', 'notoriously', 'poorly', 'paid', 'government', 'want', 'pay', 'increase', 'exchange', 'better', 'qualified', 'workforce', 'purnima', 'tanuku', 'ndna', 'chief', 'executive', 'expressed', 'serious', 'concern', 'falling', 'roll', 'urged', 'local', 'authorites', 'forthcoming', 'childcare', 'bill', 'obliged', 'provide', 'sufficient', 'childcare', 'local', 'area', 'work', 'closely', 'existing', 'private', 'voluntary', 'day', 'nursery', 'avoid', 'duplication', 'service', 'parent', 'could', 'afford', 'meet', 'increased', 'cost', 'staff', 'salary', 'government', 'aimed', 'provide', 'universal', 'high', 'quality', 'childcare', 'warned', 'meet', 'goal', 'amount', 'government', 'funding', 'must', 'reviewed', 'increased', 'significantly', 'said']",95
the vast majority of fathers will find it financially impossible to take six months paternity leave unless the time off is paid campaigners said yesterday the equal opportunities commission and the maternity alliance cautioned ministers preparing to publish the work and families bill that extended paternity leave would not be viable or a real right unless extra cash was made available their warnings came as research by the commission published yesterday highlighted a social revolution in attitudes to fatherhood with more than threequarters of new mothers surveyed saying their partner was as confident as they were at caring for a new baby more than three in five rejected the idea of a fathers main role being as the breadwinner saying they should also share in parenting and more than twothirds thought their partner would be happy to stay at home to look after the baby indications that ministers want to introduce six months paternity leave up from two weeks paid at a week at present have caught parenting campaigners and business leaders unawares since the option was not canvassed during a threemonth consultation this summer at the general election labour made much of plans to extend paid maternity leave to nine months by and months by the end of this parliament it also proposed allowing mothers to hand over some of the leave and pay to fathers in its consultation the government asked for views on this transferable maternity leave which would let fathers take over maternity rights once the baby was six months where couples wished to do so but it emerged that the proposal would fall foul of european laws forbidding governments from taking mothers existing rights away it appears that the department of trade and industry has opted to get round the legal obstacle by offering fathers their own right to six months leave providing a mother forgoes the equivalent period but indications are that the leave will not be paid though it is understood the bill will leave scope for introducing payment the move is backed by fatherhood and equality campaigners who say it finally gives fathers their own protected right to extended leave it would also mean fathers had a right to leave even if the mother had not qualified for maternity rights jenny watson the commissions acting chair said we hope the government hasnt closed the door to payment of leave for fathers and that it seizes this opportunity to halt the spread of the most unequal parenting arrangements in europe the cbis deputy director general john cridland said if the governments policy extending paternity leave is what we are led to believe it constitutes a major new employment right that was not in labours manifesto it puts pressure on employers to provide occupational paternity pay for fathers opens the door to further extensions of the law and has formed no part of the governments previous discussions with employers,2005-10,vast majority father find financially impossible take six month paternity leave unless time paid campaigner said yesterday equal opportunity commission maternity alliance cautioned minister preparing publish work family bill extended paternity leave would viable real right unless extra cash wa made available warning came research commission published yesterday highlighted social revolution attitude fatherhood threequarters new mother surveyed saying partner wa confident caring new baby three five rejected idea father main role breadwinner saying also share parenting twothirds thought partner would happy stay home look baby indication minister want introduce six month paternity leave two week paid week present caught parenting campaigner business leader unawares since option wa canvassed threemonth consultation summer general election labour made much plan extend paid maternity leave nine month month end parliament also proposed allowing mother hand leave pay father consultation government asked view transferable maternity leave would let father take maternity right baby wa six month couple wished emerged proposal would fall foul european law forbidding government taking mother existing right away appears department trade industry ha opted get round legal obstacle offering father right six month leave providing mother forgoes equivalent period indication leave paid though understood bill leave scope introducing payment move backed fatherhood equality campaigner say finally give father protected right extended leave would also mean father right leave even mother qualified maternity right jenny watson commission acting chair said hope government hasnt closed door payment leave father seizes opportunity halt spread unequal parenting arrangement europe cbis deputy director general john cridland said government policy extending paternity leave led believe constitutes major new employment right wa labour manifesto put pressure employer provide occupational paternity pay father open door extension law ha formed part government previous discussion employer,"['vast', 'majority', 'father', 'find', 'financially', 'impossible', 'take', 'six', 'month', 'paternity', 'leave', 'unless', 'time', 'paid', 'campaigner', 'said', 'yesterday', 'equal', 'opportunity', 'commission', 'maternity', 'alliance', 'cautioned', 'minister', 'preparing', 'publish', 'work', 'family', 'bill', 'extended', 'paternity', 'leave', 'would', 'viable', 'real', 'right', 'unless', 'extra', 'cash', 'wa', 'made', 'available', 'warning', 'came', 'research', 'commission', 'published', 'yesterday', 'highlighted', 'social', 'revolution', 'attitude', 'fatherhood', 'threequarters', 'new', 'mother', 'surveyed', 'saying', 'partner', 'wa', 'confident', 'caring', 'new', 'baby', 'three', 'five', 'rejected', 'idea', 'father', 'main', 'role', 'breadwinner', 'saying', 'also', 'share', 'parenting', 'twothirds', 'thought', 'partner', 'would', 'happy', 'stay', 'home', 'look', 'baby', 'indication', 'minister', 'want', 'introduce', 'six', 'month', 'paternity', 'leave', 'two', 'week', 'paid', 'week', 'present', 'caught', 'parenting', 'campaigner', 'business', 'leader', 'unawares', 'since', 'option', 'wa', 'canvassed', 'threemonth', 'consultation', 'summer', 'general', 'election', 'labour', 'made', 'much', 'plan', 'extend', 'paid', 'maternity', 'leave', 'nine', 'month', 'month', 'end', 'parliament', 'also', 'proposed', 'allowing', 'mother', 'hand', 'leave', 'pay', 'father', 'consultation', 'government', 'asked', 'view', 'transferable', 'maternity', 'leave', 'would', 'let', 'father', 'take', 'maternity', 'right', 'baby', 'wa', 'six', 'month', 'couple', 'wished', 'emerged', 'proposal', 'would', 'fall', 'foul', 'european', 'law', 'forbidding', 'government', 'taking', 'mother', 'existing', 'right', 'away', 'appears', 'department', 'trade', 'industry', 'ha', 'opted', 'get', 'round', 'legal', 'obstacle', 'offering', 'father', 'right', 'six', 'month', 'leave', 'providing', 'mother', 'forgoes', 'equivalent', 'period', 'indication', 'leave', 'paid', 'though', 'understood', 'bill', 'leave', 'scope', 'introducing', 'payment', 'move', 'backed', 'fatherhood', 'equality', 'campaigner', 'say', 'finally', 'give', 'father', 'protected', 'right', 'extended', 'leave', 'would', 'also', 'mean', 'father', 'right', 'leave', 'even', 'mother', 'qualified', 'maternity', 'right', 'jenny', 'watson', 'commission', 'acting', 'chair', 'said', 'hope', 'government', 'hasnt', 'closed', 'door', 'payment', 'leave', 'father', 'seizes', 'opportunity', 'halt', 'spread', 'unequal', 'parenting', 'arrangement', 'europe', 'cbis', 'deputy', 'director', 'general', 'john', 'cridland', 'said', 'government', 'policy', 'extending', 'paternity', 'leave', 'led', 'believe', 'constitutes', 'major', 'new', 'employment', 'right', 'wa', 'labour', 'manifesto', 'put', 'pressure', 'employer', 'provide', 'occupational', 'paternity', 'pay', 'father', 'open', 'door', 'extension', 'law', 'ha', 'formed', 'part', 'government', 'previous', 'discussion', 'employer']",200
