text,web_publication_date,processed_text,tokens,assigned_topic
enfield childcare has been transformed in four years large gaps remain especially in allday care for the underfives but care in after school clubs and groups meeting before and after formal school hours is above target and enfield parents are now virtually guaranteed the free twoandahalf hours per day nursery place for their threeyearolds that labour promised in eve stickler enfield councils early years coordinator calls it a distinct shift of emphasis others might call it a mini revolution among london boroughs enfield used to be known as an area where parents had few choices in childcare now it compares favourably with other outer london areas and wins good marks from inspec tors for the training it offers childminders and nursery staff over the past four years enfield more than exceeded the government target of creating new childcare places it created but that figure is put into perspective when one takes into account those new places that are no longer available because of nursery closure childminders changing jobs etc the net figure for expansion of childcare places in the borough is nearly a third under labours target the council also expanded its team of officials dealing with early years from three staff to but some of the team are advisers and others help with training they are not bureaucrats the word being bandied around by the political parties the council also administers a separate initiative the sure start in edmonton green and the new childrens centres in other poor parts of the borough that have been modelled on it sure start got going in its aim to give children in one deprived ward the same lan guage and other skills as those from more fortunate backgrounds by the time they enrolled in infant school sure start began with detailed targets for example to cut by the number of children with speech difficulties who needed a specialists help by the age of four these have since been scaled back partly because of rapid turnover among those living in edmonton green making it hard to track families across the borough progress in childcare has been bumpy the introduction of background checks and new registration procedures for people dealing with children caused delays some prospective childminders were put off and others stopped offering places because of the paperwork though torycontrolled since enfield council has followed labours injunction to concentrate money on the poorest parts of the borough,2005-03,enfield childcare ha transformed four year large gap remain especially allday care underfives care school club group meeting formal school hour target enfield parent virtually guaranteed free twoandahalf hour per day nursery place threeyearolds labour promised eve stickler enfield council early year coordinator call distinct shift emphasis others might call mini revolution among london borough enfield used known area parent choice childcare compare favourably outer london area win good mark inspec tor training offer childminders nursery staff past four year enfield exceeded government target creating new childcare place created figure put perspective one take account new place longer available nursery closure childminders changing job etc net figure expansion childcare place borough nearly third labour target council also expanded team official dealing early year three staff team adviser others help training bureaucrat word bandied around political party council also administers separate initiative sure start edmonton green new childrens centre poor part borough modelled sure start got going aim give child one deprived ward lan guage skill fortunate background time enrolled infant school sure start began detailed target example cut number child speech difficulty needed specialist help age four since scaled back partly rapid turnover among living edmonton green making hard track family across borough progress childcare ha bumpy introduction background check new registration procedure people dealing child caused delay prospective childminders put others stopped offering place paperwork though torycontrolled since enfield council ha followed labour injunction concentrate money poorest part borough,"['enfield', 'childcare', 'ha', 'transformed', 'four', 'year', 'large', 'gap', 'remain', 'especially', 'allday', 'care', 'underfives', 'care', 'school', 'club', 'group', 'meeting', 'formal', 'school', 'hour', 'target', 'enfield', 'parent', 'virtually', 'guaranteed', 'free', 'twoandahalf', 'hour', 'per', 'day', 'nursery', 'place', 'threeyearolds', 'labour', 'promised', 'eve', 'stickler', 'enfield', 'council', 'early', 'year', 'coordinator', 'call', 'distinct', 'shift', 'emphasis', 'others', 'might', 'call', 'mini', 'revolution', 'among', 'london', 'borough', 'enfield', 'used', 'known', 'area', 'parent', 'choice', 'childcare', 'compare', 'favourably', 'outer', 'london', 'area', 'win', 'good', 'mark', 'inspec', 'tor', 'training', 'offer', 'childminders', 'nursery', 'staff', 'past', 'four', 'year', 'enfield', 'exceeded', 'government', 'target', 'creating', 'new', 'childcare', 'place', 'created', 'figure', 'put', 'perspective', 'one', 'take', 'account', 'new', 'place', 'longer', 'available', 'nursery', 'closure', 'childminders', 'changing', 'job', 'etc', 'net', 'figure', 'expansion', 'childcare', 'place', 'borough', 'nearly', 'third', 'labour', 'target', 'council', 'also', 'expanded', 'team', 'official', 'dealing', 'early', 'year', 'three', 'staff', 'team', 'adviser', 'others', 'help', 'training', 'bureaucrat', 'word', 'bandied', 'around', 'political', 'party', 'council', 'also', 'administers', 'separate', 'initiative', 'sure', 'start', 'edmonton', 'green', 'new', 'childrens', 'centre', 'poor', 'part', 'borough', 'modelled', 'sure', 'start', 'got', 'going', 'aim', 'give', 'child', 'one', 'deprived', 'ward', 'lan', 'guage', 'skill', 'fortunate', 'background', 'time', 'enrolled', 'infant', 'school', 'sure', 'start', 'began', 'detailed', 'target', 'example', 'cut', 'number', 'child', 'speech', 'difficulty', 'needed', 'specialist', 'help', 'age', 'four', 'since', 'scaled', 'back', 'partly', 'rapid', 'turnover', 'among', 'living', 'edmonton', 'green', 'making', 'hard', 'track', 'family', 'across', 'borough', 'progress', 'childcare', 'ha', 'bumpy', 'introduction', 'background', 'check', 'new', 'registration', 'procedure', 'people', 'dealing', 'child', 'caused', 'delay', 'prospective', 'childminders', 'put', 'others', 'stopped', 'offering', 'place', 'paperwork', 'though', 'torycontrolled', 'since', 'enfield', 'council', 'ha', 'followed', 'labour', 'injunction', 'concentrate', 'money', 'poorest', 'part', 'borough']",95
a leading union today called for urgent action to tackle the chronic job segregation and undervaluing of the work women do in a bid to close the gender pay gap the demand came as research carried out for the gmb showed that women in fulltime employment worked around of the hours worked by men but only received of the pay once the difference in hours is taken into account the national gender pay gap is although it is as high as in london and almost in the east of england the union which won the first ever equal pay for work of equal value case revealed examples of workplaces with particularly high levels of job segregation and undervaluing of womens work they included a food factory where most shop floor workers were women and most managers were men a supermarket where most checkout staff were women and the majority of managers and drivers were men and a city of london financial services company where most cleaners and caterers were women and most brokers and dealers were men debbie coulter gmb deputy general secretary said that the analysis conclusively proved that job segregation and the lack of equal pay for work of equal value accounts for the lions share of the pay gap action is needed from employers and throughout the education and skills provision system to end the chronic job segregation and the undervaluing of the work that women do she said this exists throughout british industry and is accepted as the norm in most of the private sector ms coulter added that there were ways of addressing the pay gap imaginatively and progressively as is the case in areas of the public sector she said that traditional barriers were already being dismantled and greater equity was occurring among professional groups such as doctors and solicitors we would urge employers to work with unions to identify the reasons for the gender segregation within their workplace to agree strategies for eradicating gender pay imbalances and for providing equality of opportunity for half of britains workforce she said,2005-03,leading union today called urgent action tackle chronic job segregation undervaluing work woman bid close gender pay gap demand came research carried gmb showed woman fulltime employment worked around hour worked men received pay difference hour taken account national gender pay gap although high london almost east england union first ever equal pay work equal value case revealed example workplace particularly high level job segregation undervaluing womens work included food factory shop floor worker woman manager men supermarket checkout staff woman majority manager driver men city london financial service company cleaner caterer woman broker dealer men debbie coulter gmb deputy general secretary said analysis conclusively proved job segregation lack equal pay work equal value account lion share pay gap action needed employer throughout education skill provision system end chronic job segregation undervaluing work woman said exists throughout british industry accepted norm private sector coulter added way addressing pay gap imaginatively progressively case area public sector said traditional barrier already dismantled greater equity wa occurring among professional group doctor solicitor would urge employer work union identify reason gender segregation within workplace agree strategy eradicating gender pay imbalance providing equality opportunity half britain workforce said,"['leading', 'union', 'today', 'called', 'urgent', 'action', 'tackle', 'chronic', 'job', 'segregation', 'undervaluing', 'work', 'woman', 'bid', 'close', 'gender', 'pay', 'gap', 'demand', 'came', 'research', 'carried', 'gmb', 'showed', 'woman', 'fulltime', 'employment', 'worked', 'around', 'hour', 'worked', 'men', 'received', 'pay', 'difference', 'hour', 'taken', 'account', 'national', 'gender', 'pay', 'gap', 'although', 'high', 'london', 'almost', 'east', 'england', 'union', 'first', 'ever', 'equal', 'pay', 'work', 'equal', 'value', 'case', 'revealed', 'example', 'workplace', 'particularly', 'high', 'level', 'job', 'segregation', 'undervaluing', 'womens', 'work', 'included', 'food', 'factory', 'shop', 'floor', 'worker', 'woman', 'manager', 'men', 'supermarket', 'checkout', 'staff', 'woman', 'majority', 'manager', 'driver', 'men', 'city', 'london', 'financial', 'service', 'company', 'cleaner', 'caterer', 'woman', 'broker', 'dealer', 'men', 'debbie', 'coulter', 'gmb', 'deputy', 'general', 'secretary', 'said', 'analysis', 'conclusively', 'proved', 'job', 'segregation', 'lack', 'equal', 'pay', 'work', 'equal', 'value', 'account', 'lion', 'share', 'pay', 'gap', 'action', 'needed', 'employer', 'throughout', 'education', 'skill', 'provision', 'system', 'end', 'chronic', 'job', 'segregation', 'undervaluing', 'work', 'woman', 'said', 'exists', 'throughout', 'british', 'industry', 'accepted', 'norm', 'private', 'sector', 'coulter', 'added', 'way', 'addressing', 'pay', 'gap', 'imaginatively', 'progressively', 'case', 'area', 'public', 'sector', 'said', 'traditional', 'barrier', 'already', 'dismantled', 'greater', 'equity', 'wa', 'occurring', 'among', 'professional', 'group', 'doctor', 'solicitor', 'would', 'urge', 'employer', 'work', 'union', 'identify', 'reason', 'gender', 'segregation', 'within', 'workplace', 'agree', 'strategy', 'eradicating', 'gender', 'pay', 'imbalance', 'providing', 'equality', 'opportunity', 'half', 'britain', 'workforce', 'said']",266
if you are a parent you may feel you need a degree in maths to work out whether you are better off after the budget especially if you are unsure whether or not you are entitled to benefits such as child tax credit ctc in the first place you can take the strain out of doing the sums by completing a questionnaire at wwwinlandrevenuegovuktaxcredits to see if you qualify for ctc and the childcare element of the working tax credit wtc as a benchmark families with incomes of less than should feel the most improvement their income tax bills should be offset by credits according to the chancellor the good news is that the child element of ctc is going up in line with earnings rather than inflation for at least the next three years from april ctc rises from to a year however the extra cash offered to a child in its first year of life known as the baby element stays at families entitled only to ctc and not wtc will be able to earn more before the benefit is whittled away from april the first income threshold rises by to ctc is limited to for families on incomes between and a year and disappears entirely after from april lowerincome families eligible for the childcare element of wtc will be able to claim per cent of costs on a maximum weekly childcare bill of for one child or for two or more children citizens advice welcomes the increases but warns tens of thousands of families have received tax credits but due to mistakes or a change in circumstances have been asked to repay hundreds or even thousands of pounds other childlinked changes confirmed last week include an inflationlinked increase to the weekly child benefit up by pence to for the first child and by pence to for other children the benefit will also be paid to youngsters up to the age of in fulltime unpaid training from april working parents can get income tax and national insurance relief on worth of childcare a week if they use vouchers issued through their employers the government is considering a teenage topup to child trust funds the taxfree savings plans for kids that are activated in april,2005-03,parent may feel need degree math work whether better budget especially unsure whether entitled benefit child tax credit ctc first place take strain sum completing questionnaire wwwinlandrevenuegovuktaxcredits see qualify ctc childcare element working tax credit wtc benchmark family income less feel improvement income tax bill offset credit according chancellor good news child element ctc going line earnings rather inflation least next three year april ctc rise year however extra cash offered child first year life known baby element stay family entitled ctc wtc able earn benefit whittled away april first income threshold rise ctc limited family income year disappears entirely april lowerincome family eligible childcare element wtc able claim per cent cost maximum weekly childcare bill one child two child citizen advice welcome increase warns ten thousand family received tax credit due mistake change circumstance asked repay hundred even thousand pound childlinked change confirmed last week include inflationlinked increase weekly child benefit penny first child penny child benefit also paid youngster age fulltime unpaid training april working parent get income tax national insurance relief worth childcare week use voucher issued employer government considering teenage topup child trust fund taxfree saving plan kid activated april,"['parent', 'may', 'feel', 'need', 'degree', 'math', 'work', 'whether', 'better', 'budget', 'especially', 'unsure', 'whether', 'entitled', 'benefit', 'child', 'tax', 'credit', 'ctc', 'first', 'place', 'take', 'strain', 'sum', 'completing', 'questionnaire', 'wwwinlandrevenuegovuktaxcredits', 'see', 'qualify', 'ctc', 'childcare', 'element', 'working', 'tax', 'credit', 'wtc', 'benchmark', 'family', 'income', 'less', 'feel', 'improvement', 'income', 'tax', 'bill', 'offset', 'credit', 'according', 'chancellor', 'good', 'news', 'child', 'element', 'ctc', 'going', 'line', 'earnings', 'rather', 'inflation', 'least', 'next', 'three', 'year', 'april', 'ctc', 'rise', 'year', 'however', 'extra', 'cash', 'offered', 'child', 'first', 'year', 'life', 'known', 'baby', 'element', 'stay', 'family', 'entitled', 'ctc', 'wtc', 'able', 'earn', 'benefit', 'whittled', 'away', 'april', 'first', 'income', 'threshold', 'rise', 'ctc', 'limited', 'family', 'income', 'year', 'disappears', 'entirely', 'april', 'lowerincome', 'family', 'eligible', 'childcare', 'element', 'wtc', 'able', 'claim', 'per', 'cent', 'cost', 'maximum', 'weekly', 'childcare', 'bill', 'one', 'child', 'two', 'child', 'citizen', 'advice', 'welcome', 'increase', 'warns', 'ten', 'thousand', 'family', 'received', 'tax', 'credit', 'due', 'mistake', 'change', 'circumstance', 'asked', 'repay', 'hundred', 'even', 'thousand', 'pound', 'childlinked', 'change', 'confirmed', 'last', 'week', 'include', 'inflationlinked', 'increase', 'weekly', 'child', 'benefit', 'penny', 'first', 'child', 'penny', 'child', 'benefit', 'also', 'paid', 'youngster', 'age', 'fulltime', 'unpaid', 'training', 'april', 'working', 'parent', 'get', 'income', 'tax', 'national', 'insurance', 'relief', 'worth', 'childcare', 'week', 'use', 'voucher', 'issued', 'employer', 'government', 'considering', 'teenage', 'topup', 'child', 'trust', 'fund', 'taxfree', 'saving', 'plan', 'kid', 'activated', 'april']",95
twothirds of parents of young children in england are relying on family and friends for help with childcare yet many would prefer nursery care if they had the choice government research says the findings appear to confirm that availability and cost are still limiting parents childcare options while the uk has traditionally relied on informal childcare rather than formal statefunded daycare provision there are signs the trend could shift if cheaper highquality care was made more available the government is anxious to claim that its policy of investing in better formal childcare and helping parents pay for it is in line with what parents want the conservatives who are expected to publish their childcare policy in this area soon may seek to woo the family vote by offering cash to parents to use as they wish including informal care as the survey shows formal childcare is more popular the younger the parent with of yearolds saying it was their preferred option compared with just over a third of those over six out of parents said the qualification level of carers was among their top three concerns more than a third were concerned over the quality of facilities the other major worry was that childcare arrangements did not fit in with their working hours strikingly cost was not a prime concern other than for those on low incomes,2005-03,twothirds parent young child england relying family friend help childcare yet many would prefer nursery care choice government research say finding appear confirm availability cost still limiting parent childcare option uk ha traditionally relied informal childcare rather formal statefunded daycare provision sign trend could shift cheaper highquality care wa made available government anxious claim policy investing better formal childcare helping parent pay line parent want conservative expected publish childcare policy area soon may seek woo family vote offering cash parent use wish including informal care survey show formal childcare popular younger parent yearolds saying wa preferred option compared third six parent said qualification level carers wa among top three concern third concerned quality facility major worry wa childcare arrangement fit working hour strikingly cost wa prime concern low income,"['twothirds', 'parent', 'young', 'child', 'england', 'relying', 'family', 'friend', 'help', 'childcare', 'yet', 'many', 'would', 'prefer', 'nursery', 'care', 'choice', 'government', 'research', 'say', 'finding', 'appear', 'confirm', 'availability', 'cost', 'still', 'limiting', 'parent', 'childcare', 'option', 'uk', 'ha', 'traditionally', 'relied', 'informal', 'childcare', 'rather', 'formal', 'statefunded', 'daycare', 'provision', 'sign', 'trend', 'could', 'shift', 'cheaper', 'highquality', 'care', 'wa', 'made', 'available', 'government', 'anxious', 'claim', 'policy', 'investing', 'better', 'formal', 'childcare', 'helping', 'parent', 'pay', 'line', 'parent', 'want', 'conservative', 'expected', 'publish', 'childcare', 'policy', 'area', 'soon', 'may', 'seek', 'woo', 'family', 'vote', 'offering', 'cash', 'parent', 'use', 'wish', 'including', 'informal', 'care', 'survey', 'show', 'formal', 'childcare', 'popular', 'younger', 'parent', 'yearolds', 'saying', 'wa', 'preferred', 'option', 'compared', 'third', 'six', 'parent', 'said', 'qualification', 'level', 'carers', 'wa', 'among', 'top', 'three', 'concern', 'third', 'concerned', 'quality', 'facility', 'major', 'worry', 'wa', 'childcare', 'arrangement', 'fit', 'working', 'hour', 'strikingly', 'cost', 'wa', 'prime', 'concern', 'low', 'income']",95
